{
  "$schema": "./tianyan-skills.schema.json",
  "formatVersion": 1,
  "contentRevision": 2,
  "baseSkillIds": [
    "tianyan.skill.wood",
    "tianyan.skill.fire",
    "tianyan.skill.earth",
    "tianyan.skill.metal",
    "tianyan.skill.water",
    "tianyan.skill.ward",
    "tianyan.skill.clarity"
  ],
  "elemental": [
    {
      "element": "wood",
      "skill": {
        "id": "tianyan.skill.wood",
        "name": "森罗缚",
        "description": "攻击一个敌人，令其速度降低10%，持续2回合。水印→滋荣：为气血比例最低的一名友方附加2次回合末恢复。土印→裂土：令目标法防降低15%，持续2回合。 成功施放后留下自身木行法印；只保留最后一道法印。",
        "school": "tianyan",
        "costMp": "35*(1-0.25*known.tianyan.passive.return*(hasStatus.tianyan.status.mark.water+hasStatus.tianyan.status.mark.earth))*(1-0.15*known.tianyan.passive.ceaseless)*(1-0.10*known.tianyan.passive.heng_root)",
        "tags": [
          "spell"
        ],
        "formula": "spell",
        "sealBase": 45,
        "targeting": {
          "side": "enemy",
          "mode": "fill",
          "count": 1
        },
        "effects": [
          {
            "type": "spellHit",
            "coeff": 1.0,
            "power": "skillLevel*1.1"
          },
          {
            "type": "applyStatus",
            "statusId": "tianyan.status.bind",
            "duration": "2+known.tianyan.passive.law"
          },
          {
            "type": "restoreMp",
            "power": 10,
            "targeting": {
              "side": "self"
            },
            "when": {
              "requireStatusIds": [
                "tianyan.status.mark.water"
              ],
              "expression": "known.tianyan.passive.breath"
            }
          },
          {
            "type": "applyStatus",
            "statusId": "tianyan.status.adapt",
            "duration": 2,
            "targeting": {
              "side": "self"
            },
            "when": {
              "requireStatusIds": [
                "tianyan.status.mark.earth"
              ],
              "expression": "known.tianyan.passive.adapt"
            }
          },
          {
            "type": "applyStatus",
            "statusId": "tianyan.status.balance",
            "duration": 1,
            "targeting": {
              "side": "self"
            },
            "when": {
              "requireStatusIds": [
                "tianyan.status.mark.earth"
              ],
              "expression": "known.tianyan.passive.balance"
            }
          }
        ]
      }
    },
    {
      "element": "fire",
      "skill": {
        "id": "tianyan.skill.fire",
        "name": "焚天流火",
        "description": "攻击三个敌人。木印→燎原：攻击人数增加至四人。金印→熔锋：令受击目标物攻、法攻降低10%，持续2回合。 成功施放后留下自身火行法印；只保留最后一道法印。",
        "school": "tianyan",
        "costMp": "75*(1-0.25*known.tianyan.passive.return*(hasStatus.tianyan.status.mark.wood+hasStatus.tianyan.status.mark.metal))*(1-0.15*known.tianyan.passive.ceaseless)*(1+0.10*known.tianyan.passive.scarlet)",
        "tags": [
          "spell"
        ],
        "formula": "spell",
        "sealBase": 45,
        "targeting": {
          "side": "enemy",
          "mode": "fill",
          "count": "3+hasStatus.tianyan.status.mark.wood*(1-known.tianyan.passive.ember+known.tianyan.passive.wild)-known.tianyan.passive.blunt"
        },
        "effects": [
          {
            "type": "spellHit",
            "coeff": 1.05,
            "power": "skillLevel*1.1"
          },
          {
            "type": "restoreMp",
            "power": 10,
            "targeting": {
              "side": "self"
            },
            "when": {
              "requireStatusIds": [
                "tianyan.status.mark.wood"
              ],
              "expression": "known.tianyan.passive.breath"
            }
          },
          {
            "type": "applyStatus",
            "statusId": "tianyan.status.adapt",
            "duration": 2,
            "targeting": {
              "side": "self"
            },
            "when": {
              "requireStatusIds": [
                "tianyan.status.mark.metal"
              ],
              "expression": "known.tianyan.passive.adapt"
            }
          },
          {
            "type": "applyStatus",
            "statusId": "tianyan.status.balance",
            "duration": 1,
            "targeting": {
              "side": "self"
            },
            "when": {
              "requireStatusIds": [
                "tianyan.status.mark.metal"
              ],
              "expression": "known.tianyan.passive.balance"
            }
          }
        ]
      }
    },
    {
      "element": "earth",
      "skill": {
        "id": "tianyan.skill.earth",
        "name": "山河倾覆",
        "description": "攻击一个敌人，使其下一次造成伤害的行动伤害降低15%，2回合内有效。火印→烬垒：施法后为自身附加2回合护盾。水印→截流：按封印命中规则附加1回合封法。 成功施放后留下自身土行法印；只保留最后一道法印。",
        "school": "tianyan",
        "costMp": "40*(1-0.25*known.tianyan.passive.return*(hasStatus.tianyan.status.mark.fire+hasStatus.tianyan.status.mark.water))*(1-0.15*known.tianyan.passive.ceaseless)*(1-0.10*known.tianyan.passive.heng_root)*(1+0.20*known.tianyan.passive.mountain)",
        "tags": [
          "spell"
        ],
        "formula": "spell",
        "sealBase": 45,
        "targeting": {
          "side": "enemy",
          "mode": "fill",
          "count": 1
        },
        "effects": [
          {
            "type": "spellHit",
            "coeff": 1.05,
            "power": "skillLevel*1.2"
          },
          {
            "type": "applyStatus",
            "statusId": "tianyan.status.weaken",
            "duration": 2,
            "when": {
              "expression": "(1-known.tianyan.passive.mountain)*(1-known.tianyan.passive.severance)"
            }
          },
          {
            "type": "applyStatus",
            "statusId": "tianyan.status.weaken_deep",
            "duration": 2,
            "when": {
              "expression": "(known.tianyan.passive.mountain)*(1-known.tianyan.passive.severance)"
            }
          },
          {
            "type": "applyStatus",
            "statusId": "tianyan.status.truce_deep",
            "duration": 2,
            "when": {
              "expression": "known.tianyan.passive.severance"
            }
          },
          {
            "type": "restoreMp",
            "power": 10,
            "targeting": {
              "side": "self"
            },
            "when": {
              "requireStatusIds": [
                "tianyan.status.mark.fire"
              ],
              "expression": "known.tianyan.passive.breath"
            }
          },
          {
            "type": "applyStatus",
            "statusId": "tianyan.status.adapt",
            "duration": 2,
            "targeting": {
              "side": "self"
            },
            "when": {
              "requireStatusIds": [
                "tianyan.status.mark.water"
              ],
              "expression": "known.tianyan.passive.adapt"
            }
          },
          {
            "type": "applyStatus",
            "statusId": "tianyan.status.balance",
            "duration": 1,
            "targeting": {
              "side": "self"
            },
            "when": {
              "requireStatusIds": [
                "tianyan.status.mark.water"
              ],
              "expression": "known.tianyan.passive.balance"
            }
          }
        ]
      }
    },
    {
      "element": "metal",
      "skill": {
        "id": "tianyan.skill.metal",
        "name": "天锋一线",
        "description": "攻击一个敌人，护盾承受的伤害额外提高50%，溢出的气血伤害不提高。土印→淬锋：额外忽视20%法防。木印→断枝：驱散目标一个可驱散增益。 成功施放后留下自身金行法印；只保留最后一道法印。",
        "school": "tianyan",
        "costMp": "40*(1-0.25*known.tianyan.passive.return*(hasStatus.tianyan.status.mark.earth+hasStatus.tianyan.status.mark.wood))*(1-0.15*known.tianyan.passive.ceaseless)*(1-0.10*known.tianyan.passive.heng_root)",
        "tags": [
          "spell"
        ],
        "formula": "spell",
        "sealBase": 45,
        "targeting": {
          "side": "enemy",
          "mode": "fill",
          "count": "1+hasStatus.tianyan.status.mark.earth*known.tianyan.passive.split"
        },
        "effects": [
          {
            "type": "spellHit",
            "coeff": 1.15,
            "power": "skillLevel*1.4"
          },
          {
            "type": "restoreMp",
            "power": 10,
            "targeting": {
              "side": "self"
            },
            "when": {
              "requireStatusIds": [
                "tianyan.status.mark.earth"
              ],
              "expression": "known.tianyan.passive.breath"
            }
          },
          {
            "type": "applyStatus",
            "statusId": "tianyan.status.adapt",
            "duration": 2,
            "targeting": {
              "side": "self"
            },
            "when": {
              "requireStatusIds": [
                "tianyan.status.mark.wood"
              ],
              "expression": "known.tianyan.passive.adapt"
            }
          },
          {
            "type": "applyStatus",
            "statusId": "tianyan.status.balance",
            "duration": 1,
            "targeting": {
              "side": "self"
            },
            "when": {
              "requireStatusIds": [
                "tianyan.status.mark.wood"
              ],
              "expression": "known.tianyan.passive.balance"
            }
          }
        ],
        "modifiers": [
          {
            "barrierDamageBonus": "0.5-0.25*known.tianyan.passive.edge+0.75*known.tianyan.passive.wall",
            "when": {
              "skillIds": [
                "tianyan.skill.metal"
              ]
            }
          }
        ]
      }
    },
    {
      "element": "water",
      "skill": {
        "id": "tianyan.skill.water",
        "name": "沧海横流",
        "description": "以较低法力攻击三个敌人。金印→凝露：施法后治疗气血比例最低的一名友方。火印→蒸腾：本次法术伤害提高20%。 成功施放后留下自身水行法印；只保留最后一道法印。",
        "school": "tianyan",